{
 "schema": "route-report/1",
 "origin": "REAL_OBSERVATION_PIPELINE",
 "runId": "ROUTE_EVAL_002",
 "evaluationRole": "DEV",
 "producerStatus": "ROUTE_REPORT_DEV_REUSED_NOT_ADOPTED",
 "receiptSha256": "6c35df009aab905af37e2017951d76114307cbd994366d5b5780c34d583b2c51",
 "dataset": {
  "manifestSha256": "a2e42ab6ab45c1f33c8963b13456fe957a500f1752c9d027f4125a0cb0cc7a62",
  "trainRows": 38651044,
  "devRows": 20989927,
  "trainGroups": 631972,
  "devGroups": 351831
 },
 "routeMap": {
  "sha256": "91a6accec16a586cb6af182683c93345a73a87f75d857ac475740bd14fab87b2",
  "routeDefinition": "R.route_id",
  "tokenKind": "OPAQUE_ROUTE_TOKEN",
  "knownRouteCount": 20,
  "unknownGroupCount": 0
 },
 "routes": [
  {
   "token": "11983c18a94b2541",
   "devRows": 1488209,
   "devGroups": 24926,
   "weightSum": 24926.000000000262,
   "trainSupport": {
    "rows": 2217231,
    "groups": 38842
   }
  },
  {
   "token": "20a3c417e4483df7",
   "devRows": 3418694,
   "devGroups": 46603,
   "weightSum": 46603.00000000033,
   "trainSupport": {
    "rows": 9906651,
    "groups": 138508
   }
  },
  {
   "token": "21555640f1481b45",
   "devRows": 671732,
   "devGroups": 16992,
   "weightSum": 16992.00000000013,
   "trainSupport": null
  },
  {
   "token": "34d09f333fc263e0",
   "devRows": 1594199,
   "devGroups": 24967,
   "weightSum": 24967.000000000313,
   "trainSupport": {
    "rows": 2361203,
    "groups": 39182
   }
  },
  {
   "token": "40a49e30355aaf8a",
   "devRows": 1374835,
   "devGroups": 23138,
   "weightSum": 23138.00000000025,
   "trainSupport": {
    "rows": 1980357,
    "groups": 35194
   }
  },
  {
   "token": "4204dcfddd88b6d6",
   "devRows": 122830,
   "devGroups": 2668,
   "weightSum": 2668.0,
   "trainSupport": null
  },
  {
   "token": "427c783dbf6745bf",
   "devRows": 3965909,
   "devGroups": 63007,
   "weightSum": 63007.00000000009,
   "trainSupport": {
    "rows": 12660533,
    "groups": 210660
   }
  },
  {
   "token": "4f68b3d7c52d0547",
   "devRows": 209827,
   "devGroups": 4294,
   "weightSum": 4294.0000000000055,
   "trainSupport": null
  },
  {
   "token": "69e47d59adbc2349",
   "devRows": 147146,
   "devGroups": 2470,
   "weightSum": 2470.0000000000005,
   "trainSupport": null
  },
  {
   "token": "7004ceff23e62fdc",
   "devRows": 52269,
   "devGroups": 830,
   "weightSum": 829.9999999999994,
   "trainSupport": null
  },
  {
   "token": "945f073a865f981b",
   "devRows": 90497,
   "devGroups": 1893,
   "weightSum": 1893.0000000000002,
   "trainSupport": null
  },
  {
   "token": "a694167ec8c8a00e",
   "devRows": 469181,
   "devGroups": 10664,
   "weightSum": 10664.000000000056,
   "trainSupport": null
  },
  {
   "token": "af8480f3a7362ff7",
   "devRows": 69677,
   "devGroups": 894,
   "weightSum": 894.0,
   "trainSupport": null
  },
  {
   "token": "b132dbb36667fc9a",
   "devRows": 131052,
   "devGroups": 2836,
   "weightSum": 2835.9999999999995,
   "trainSupport": null
  },
  {
   "token": "c11c9aba643eed45",
   "devRows": 3067145,
   "devGroups": 57990,
   "weightSum": 57990.00000000076,
   "trainSupport": {
    "rows": 4439053,
    "groups": 85300
   }
  },
  {
   "token": "dbc7c4c33e82a097",
   "devRows": 667507,
   "devGroups": 8534,
   "weightSum": 8534.00000000002,
   "trainSupport": {
    "rows": 946961,
    "groups": 12705
   }
  },
  {
   "token": "dcdd4345f47efb41",
   "devRows": 167451,
   "devGroups": 2946,
   "weightSum": 2946.0000000000027,
   "trainSupport": null
  },
  {
   "token": "e3d463a0c1d8fb0e",
   "devRows": 204758,
   "devGroups": 3635,
   "weightSum": 3634.9999999999986,
   "trainSupport": null
  },
  {
   "token": "f53f6fe37d101193",
   "devRows": 295841,
   "devGroups": 6710,
   "weightSum": 6710.000000000008,
   "trainSupport": null
  },
  {
   "token": "f5946448c9eecac9",
   "devRows": 2781168,
   "devGroups": 45834,
   "weightSum": 45834.000000000626,
   "trainSupport": {
    "rows": 4139055,
    "groups": 71581
   }
  }
 ],
 "unknown": {
  "devRows": 0,
  "devGroups": 0,
  "weightSum": 0.0
 },
 "models": [
  {
   "id": "B256",
   "role": "REFERENCE",
   "trainingMode": "CONTINUED_REFERENCE",
   "depth": 6,
   "rounds": 256,
   "publishedGlobal": {
    "source": "full-learning-batch.json",
    "MAE": 4.457313790999137,
    "MSE": 51.61923031403158
   },
   "micro": {
    "MAE": 4.457313790999101,
    "MSE": 51.61923031403105,
    "pairedMAEDelta": null,
    "pairedMSEDelta": null
   },
   "knownRouteMacro": {
    "MAE": 4.022487242289152,
    "MSE": 43.22451826681612,
    "routeCount": 20
   },
   "unknown": {
    "MAE": null,
    "MSE": null,
    "pairedMAEDelta": null,
    "pairedMSEDelta": null
   },
   "routes": [
    {
     "token": "11983c18a94b2541",
     "MAE": 4.853018385350112,
     "MSE": 54.15817449761871,
     "pairedMAEDelta": null,
     "pairedMSEDelta": null
    },
    {
     "token": "20a3c417e4483df7",
     "MAE": 4.770782118541147,
     "MSE": 54.4040696818533,
     "pairedMAEDelta": null,
     "pairedMSEDelta": null
    },
    {
     "token": "21555640f1481b45",
     "MAE": 2.996094651342023,
     "MSE": 23.012457029730978,
     "pairedMAEDelta": null,
     "pairedMSEDelta": null
    },
    {
     "token": "34d09f333fc263e0",
     "MAE": 5.201781669420735,
     "MSE": 71.20684131055708,
     "pairedMAEDelta": null,
     "pairedMSEDelta": null
    },
    {
     "token": "40a49e30355aaf8a",
     "MAE": 4.770676187938797,
     "MSE": 59.24806601425777,
     "pairedMAEDelta": null,
     "pairedMSEDelta": null
    },
    {
     "token": "4204dcfddd88b6d6",
     "MAE": 2.009191335126681,
     "MSE": 8.244073766626077,
     "pairedMAEDelta": null,
     "pairedMSEDelta": null
    },
    {
     "token": "427c783dbf6745bf",
     "MAE": 4.707201618749977,
     "MSE": 59.96026175169625,
     "pairedMAEDelta": null,
     "pairedMSEDelta": null
    },
    {
     "token": "4f68b3d7c52d0547",
     "MAE": 3.2718930792753538,
     "MSE": 26.301987667768376,
     "pairedMAEDelta": null,
     "pairedMSEDelta": null
    },
    {
     "token": "69e47d59adbc2349",
     "MAE": 2.523052812580624,
     "MSE": 20.22437426424713,
     "pairedMAEDelta": null,
     "pairedMSEDelta": null
    },
    {
     "token": "7004ceff23e62fdc",
     "MAE": 4.558100299460207,
     "MSE": 44.515538486210374,
     "pairedMAEDelta": null,
     "pairedMSEDelta": null
    },
    {
     "token": "945f073a865f981b",
     "MAE": 3.986337477311781,
     "MSE": 43.170354541479405,
     "pairedMAEDelta": null,
     "pairedMSEDelta": null
    },
    {
     "token": "a694167ec8c8a00e",
     "MAE": 3.6870072914875243,
     "MSE": 34.37352597079547,
     "pairedMAEDelta": null,
     "pairedMSEDelta": null
    },
    {
     "token": "af8480f3a7362ff7",
     "MAE": 3.218373931180584,
     "MSE": 25.22291148369018,
     "pairedMAEDelta": null,
     "pairedMSEDelta": null
    },
    {
     "token": "b132dbb36667fc9a",
     "MAE": 2.0868099059987304,
     "MSE": 8.65409770714142,
     "pairedMAEDelta": null,
     "pairedMSEDelta": null
    },
    {
     "token": "c11c9aba643eed45",
     "MAE": 4.194506131463842,
     "MSE": 48.489064624474224,
     "pairedMAEDelta": null,
     "pairedMSEDelta": null
    },
    {
     "token": "dbc7c4c33e82a097",
     "MAE": 5.214082888012297,
     "MSE": 65.48298466951076,
     "pairedMAEDelta": null,
     "pairedMSEDelta": null
    },
    {
     "token": "dcdd4345f47efb41",
     "MAE": 3.5683628161311844,
     "MSE": 37.41124404118693,
     "pairedMAEDelta": null,
     "pairedMSEDelta": null
    },
    {
     "token": "e3d463a0c1d8fb0e",
     "MAE": 6.379038744417025,
     "MSE": 89.84500371952028,
     "pairedMAEDelta": null,
     "pairedMSEDelta": null
    },
    {
     "token": "f53f6fe37d101193",
     "MAE": 4.0079560584125975,
     "MSE": 43.89725779008611,
     "pairedMAEDelta": null,
     "pairedMSEDelta": null
    },
    {
     "token": "f5946448c9eecac9",
     "MAE": 4.445477443581823,
     "MSE": 46.668076317871524,
     "pairedMAEDelta": null,
     "pairedMSEDelta": null
    }
   ]
  },
  {
   "id": "D4",
   "role": "CANDIDATE",
   "trainingMode": "FRESH_FROM_ZERO",
   "depth": 4,
   "rounds": 256,
   "publishedGlobal": {
    "source": "full-depth-sweep.json",
    "MAE": 4.477016485836823,
    "MSE": 51.89817678377675
   },
   "micro": {
    "MAE": 4.477016485836786,
    "MSE": 51.89817678377623,
    "pairedMAEDelta": 0.01970269483768483,
    "pairedMSEDelta": 0.2789464697451791
   },
   "knownRouteMacro": {
    "MAE": 4.020309169339944,
    "MSE": 43.113904037142504,
    "routeCount": 20
   },
   "unknown": {
    "MAE": null,
    "MSE": null,
    "pairedMAEDelta": null,
    "pairedMSEDelta": null
   },
   "routes": [
    {
     "token": "11983c18a94b2541",
     "MAE": 4.870393757044303,
     "MSE": 54.40130521620427,
     "pairedMAEDelta": 0.017375371694190456,
     "pairedMSEDelta": 0.24313071858556157
    },
    {
     "token": "20a3c417e4483df7",
     "MAE": 4.792686580019193,
     "MSE": 54.716716307875465,
     "pairedMAEDelta": 0.021904461478046144,
     "pairedMSEDelta": 0.31264662602216475
    },
    {
     "token": "21555640f1481b45",
     "MAE": 2.9712307936841778,
     "MSE": 22.981752960367754,
     "pairedMAEDelta": -0.024863857657845045,
     "pairedMSEDelta": -0.030704069363224562
    },
    {
     "token": "34d09f333fc263e0",
     "MAE": 5.266192806337823,
     "MSE": 71.69566219545301,
     "pairedMAEDelta": 0.06441113691708811,
     "pairedMSEDelta": 0.48882088489592945
    },
    {
     "token": "40a49e30355aaf8a",
     "MAE": 4.78826763633493,
     "MSE": 59.05217737513096,
     "pairedMAEDelta": 0.017591448396133025,
     "pairedMSEDelta": -0.19588863912681376
    },
    {
     "token": "4204dcfddd88b6d6",
     "MAE": 1.992621988280784,
     "MSE": 8.14447960820025,
     "pairedMAEDelta": -0.01656934684589695,
     "pairedMSEDelta": -0.09959415842582686
    },
    {
     "token": "427c783dbf6745bf",
     "MAE": 4.776472197118129,
     "MSE": 61.462555142028584,
     "pairedMAEDelta": 0.06927057836815198,
     "pairedMSEDelta": 1.5022933903323334